{
  "project": "demo",
  "primary_metric": {"name": "auroc", "direction": "max"},
  "current_state": {"v": 1, "phase": "FRAME", "updated_at": "2026-04-12T00:00:00Z"},
  "runs": [
    {
      "id": "r-v1-001", "v": 1, "created_at": "2026-04-12T00:00:00Z",
      "model": "logreg", "params_summary": "C=1.0", "features_used": 5,
      "cv_mean": 0.72, "cv_std": 0.02, "cv_ci95": [0.68, 0.76],
      "lift_vs_baseline": 0.0, "status": "valid",
      "seed": 42, "data_sha256": "abc", "env_lock_hash": "h1",
      "baseline": true
    }
  ],
  "disproven": [],
  "events": []
}
